{
  "items": [
    {
      "key": "lot-1",
      "material": {
        "bt": "c3b1e0c2-8a4e-4f64-9a51-2b9f5c7e0a11",
        "name": "Laranite"
      },
      "location": {
        "name": "Area18",
        "uex": {
          "kind": "CITY",
          "id": 4
        }
      },
      "quality": 1,
      "stolen": false,
      "quantity": {
        "amount": 12.5,
        "unit": "SCU"
      },
      "split": {
        "personal": {
          "amount": 4.5,
          "unit": "SCU"
        },
        "pools": [
          {
            "orgUnit": {
              "id": "0c2f8a51-7d3e-4b9a-9f10-5a6b7c8d9e01"
            },
            "quantity": {
              "amount": 8,
              "unit": "SCU"
            }
          }
        ]
      }
    },
    {
      "key": "lot-2",
      "material": {
        "bt": "4a7c9e12-5b3d-4f81-a6e0-8d2c1b0f9e34",
        "name": "FR-66"
      },
      "component": {
        "componentType": "SHIELD",
        "size": 1,
        "grade": "A",
        "itemClass": "MILITARY"
      },
      "location": {
        "name": "Area18",
        "uex": {
          "kind": "CITY",
          "id": 4
        }
      },
      "quality": 0,
      "stolen": false,
      "quantity": {
        "amount": 2,
        "unit": "PIECE"
      },
      "split": {
        "personal": {
          "amount": 2,
          "unit": "PIECE"
        },
        "pools": []
      }
    }
  ],
  "removed": [],
  "nextCursor": null,
  "hasMore": false
}
